{
  "schemaVersion": "read-only-local-file-batch-manifest-v0",
  "batchMode": "manual_explicit_redacted_file_list",
  "explicitInputListOnly": true,
  "directoryDiscovery": false,
  "globAllowed": false,
  "watcherAllowed": false,
  "daemonAllowed": false,
  "networkAllowed": false,
  "liveTrafficAllowed": false,
  "recordOnly": true,
  "maxInputCount": 5,
  "inputs": [
    {
      "sourceFilePath": "implementation/synaptic-mesh-shadow-v0/fixtures/redacted/batch-case-001.json",
      "sourceArtifactDigest": "sha256:9c145c9508462da2a709fd897959f76f988ca98e26f85e99517c5a186985932b",
      "sourceAlreadyRedacted": true,
      "redactionReviewRecordId": "rrr_batch_001"
    },
    {
      "sourceFilePath": "implementation/synaptic-mesh-shadow-v0/fixtures/redacted/batch-case-002.json",
      "sourceArtifactDigest": "sha256:c2769964d9f5d622d80d1199e1dab9868ccda3bd29137fc649f436b8e3dd35f4",
      "sourceAlreadyRedacted": true,
      "redactionReviewRecordId": "rrr_batch_002"
    },
    {
      "sourceFilePath": "implementation/synaptic-mesh-shadow-v0/fixtures/redacted/batch-case-003.json",
      "sourceArtifactDigest": "sha256:cf157440a472b7cd066148db3f87a91d19e69d959ac142cd581543fab4824b9c",
      "sourceAlreadyRedacted": true,
      "redactionReviewRecordId": "rrr_batch_003"
    }
  ]
}
